{"authority":{"event_count":2,"head_event_id":"event_bbbbbbbbbbbbbbbbbbbbbbbbbbbbbbbb","log_hash":"sha256:962fadf799bd91b256a13b52fef0acdb277ac1ff4ca6589391112e1bc53e49e0"},"book_id":"book_concurrency","lock_contention":{"authority_bytes_unchanged":true,"error":"event-log lock timeout after 0.050s","exit_code":7,"outcome":"resource_guard","timeout_seconds":0.05},"projection":{"head_matches_authority":true,"last_applied_event_id":"event_bbbbbbbbbbbbbbbbbbbbbbbbbbbbbbbb","state_hash":"sha256:2d0bc5476d5eb27d3a61e174c94522abca0e12076fe9bef23d130c3d587574e7"},"report_hash":"sha256:ded424eb24c09a3c74679d6ae56061ca709e5bdf08a7ec934d77978a6e1a6cee","same_parent_race":{"conflict_count":1,"contenders":[{"actor_id":"contender_a","actor_type":"human","book_id":"book_concurrency","branch_id":"main","event_id":"event_aaaaaaaaaaaaaaaaaaaaaaaaaaaaaaaa","event_type":"audit.completed","evidence_refs":[],"parent_event_id":"event_00000000000000000000000000000001","payload":{"probe":"contender_a"},"payload_hash":"sha256:17e2191f93639c5f119d8542f2d78ba8997042a9bcd19da50ce68bd72d47137d","recorded_at":"2026-09-30T00:00:00+00:00","source_run_id":"run_contender_a","story_seq":1,"supersedes":null},{"actor_id":"contender_b","actor_type":"human","book_id":"book_concurrency","branch_id":"main","event_id":"event_bbbbbbbbbbbbbbbbbbbbbbbbbbbbbbbb","event_type":"audit.completed","evidence_refs":[],"parent_event_id":"event_00000000000000000000000000000001","payload":{"probe":"contender_b"},"payload_hash":"sha256:a9ee1ed2443d0c335d57aaa918342b6c8e86934a79c9312a18e2624f1af5bcbe","recorded_at":"2026-09-30T00:00:00+00:00","source_run_id":"run_contender_b","story_seq":1,"supersedes":null}],"outcomes":[{"error":"parent conflict on main: current head is event_bbbbbbbbbbbbbbbbbbbbbbbbbbbbbbbb, candidate parent is event_00000000000000000000000000000001","event_id":"event_aaaaaaaaaaaaaaaaaaaaaaaaaaaaaaaa","exit_code":7,"outcome":"parent_conflict"},{"event_id":"event_bbbbbbbbbbbbbbbbbbbbbbbbbbbbbbbb","exit_code":0,"outcome":"winner"}],"parent_event_id":"event_00000000000000000000000000000001","winner_count":1,"winner_event_id":"event_bbbbbbbbbbbbbbbbbbbbbbbbbbbbbbbb"},"schema_version":"concurrency-guard-report.v1","scope":{"distributed_lock_tested":false,"multi_process_tested":false,"single_book":true,"single_process_threads":true,"throughput_claim":false},"silent_overwrite":false}